项目性质,项目名称,所属行业,组织形式,招标方式,招标编号/项目编号,招标条件/说明,中标人名称,中标价格,其他公示内容,监督部门,招标人/采购人,招标人地址,招标人联系人,招标人联系方式,招标代理机构,招标代理机构地址,招标代理机构联系人,招标代理机构联系方式,发布日期,发布网站,详情页面
依法招标,[霍州智创独立储能项目（EPC总承包）监理二次] 中标结果公示,,,,SXZF-FW-20260501-1）,,华兴建业有限公司 中标金额：1889600.00元,1889600.00元,无,,,,,,山西中凡项目管理有限公司 地址：山西省太原市晋源区阳光环球金融中心B座1401 联 系 人：王科凡、边星,山西省太原市晋源区阳光环球金融中心B座1401 联 系 人：王科凡、边星,王科凡、边星,,2026-06-22,国信e采购平台,https://gx.e-bidding.org/sdny_resultBulletin/2026-06-22/10854.html
依法招标,[交城县污水处理厂系统更新改造项目EPC总承包主要设备采购项目]（第一标段） 中标结果公示,,,,XC01-HZ260301） 本交城县污水处理厂系统更新改造项目EPC总承包主要设备采购项目（招标,,深圳市沃地污染修复技术有限公司 中标金额：14682800.00元,14682800.00元,无,交城县住房和城乡建设管理局 电话：张晋生 电子邮箱：18536874134,,东莞市南城街道黄金路1号天安数码城C1栋801、807号 联系人:林工 电话：13071332190 0769-38912315,林工 电话：13071332190 0769-38912315,13071332190 0769-38912315,山西昕宸工程咨询有限公司 地址：太原市小店区科技街15号新岛科技园E座南区5楼503室 联系人：杨龙丹 联系电话：16613512852 电子邮件：xc123456782025@yeah.net,太原市小店区科技街15号新岛科技园E座南区5楼503室 联系人：杨龙丹 联系电话：16613512852 电子邮件：xc123456782025@yeah.net,杨龙丹 联系电话：16613512852 电子邮件：xc123456782025@yeah.net,16613512852 电子邮件：xc123456782025@yeah.net,2026-06-22,国信e采购平台,https://gx.e-bidding.org/sdny_resultBulletin/2026-06-22/10848.html
依法招标,[霍州智创独立储能项目（EPC总承包）] 中标结果公示,,,,SXZF-GC-20260402）,,牵头人：中国建筑第六工程局有限公司 联合体成员：中煤科工重庆设计研究院（集团）有限公司 中标金额：676800000.00元 质保期：响应招标文件要求 工期：270日历天,676800000.00元 质保期：响应招标文件要求 工期：270日历天,无,,,,刘先生 电话：13363517065,13363517065,山西中凡项目管理有限公司 地址：山西省太原市晋源区阳光环球金融中心B座1401 联系人：卢鹏斌、王科凡,山西省太原市晋源区阳光环球金融中心B座1401 联系人：卢鹏斌、王科凡,卢鹏斌、王科凡,,2026-06-01,国信e采购平台,https://gx.e-bidding.org/sdny_resultBulletin/2026-06-01/10645.html
依法招标,[古交市城区棚户区改造安置项目三岔口安置项目10KV供电工程] 中标结果公示,,,,GXZB-2026-028） 本项目古交市城区棚户区改造安置项目三岔口安置项目10KV供电工程,,山西海鑫盈润工程科技有限公司 中标金额：8983763.79元,8983763.79元,无,,,山西省太原市古交市 联系人：暴先生 电话:0351-5213369,暴先生 电话:0351-5213369,0351-5213369,山西广信建设项目管理有限公司 地址：太原市南中环街晋润国际B座2202 联系人：张凤、侯智慧、赵瑛、薛飞、王泰炜、温莉、田永峰 电话：0351-7246970 电子邮件：gxzb602@163.com 采购人或其采购代理机构主要负责人（项目负责人）： （签名） 采购人或其采购代理机构： （盖章）,太原市南中环街晋润国际B座2202 联系人：张凤、侯智慧、赵瑛、薛飞、王泰炜、温莉、田永峰 电话：0351-7246970 电子邮件：gxzb602@163.com 采购人或其采购代理机构主要负责人（项目负责人）： （签名） 采购人或其采购代理机构： （盖章）,张凤、侯智慧、赵瑛、薛飞、王泰炜、温莉、田永峰 电话：0351-7246970 电子邮件：gxzb602@163.com 采购人或其采购代理机构主要负责人（项目负责人）： （签名） 采购人或其采购代理机构： （盖章）,0351-7246970 电子邮件：gxzb602@163.com 采购人或其采购代理机构主要负责人（项目负责人）： （签名） 采购人或其采购代理机构： （盖章）,2026-05-27,国信e采购平台,https://gx.e-bidding.org/sdny_resultBulletin/2026-05-27/10624.html
依法招标,[交城县污水处理厂系统更新改造项目EPC总承包主要设备采购项目]（第二标段） 中标结果公示,,,,XC01-HZ260301） 本交城县污水处理厂系统更新改造项目EPC总承包主要设备采购项目（招标,,深圳原野森环保技术有限公司 中标金额：2696610.00元,2696610.00元,无,交城县住房和城乡建设管理局 电话：张晋生 电子邮箱：18536874134,,东莞市南城街道黄金路1号天安数码城C1栋801、807号 联系人:林工 电话：13071332190 0769-38912315,林工 电话：13071332190 0769-38912315,13071332190 0769-38912315,山西昕宸工程咨询有限公司 地址：太原市小店区科技街15号新岛科技园E座南区5楼503室 联系人：杨龙丹 联系电话：16613512852 电子邮件：xc123456782025@yeah.net,太原市小店区科技街15号新岛科技园E座南区5楼503室 联系人：杨龙丹 联系电话：16613512852 电子邮件：xc123456782025@yeah.net,杨龙丹 联系电话：16613512852 电子邮件：xc123456782025@yeah.net,16613512852 电子邮件：xc123456782025@yeah.net,2026-06-22,国信e采购平台,https://gx.e-bidding.org/sdny_resultBulletin/2026-06-22/10849.html
